{"$schema":"hoverpocket://schemas/pocket-workflow/v1","workflowVersion":1,"id":"startWork","inputs":{"title":"string"},"approval":{"mode":"before_writes","group":"all_writes"},"steps":[{"id":"timer","use":"timer.countdown.start@1","with":{"durationSeconds":900,"title":"$input.title"},"dependsOn":[]},{"id":"note","use":"sticky.note.upsert@1","with":{"stableKey":"tool-a98142e2abe3c46ef86c9ac9c5:current","title":"$input.title","body":"$input.title","color":"yellow"},"dependsOn":["timer"]}],"onPartialFailure":{"mode":"compensate_if_available","presentReceipt":true},"limits":{"maxSteps":8,"maxDepth":2,"timeoutSeconds":30}}