{
  "$schema": "hoverpocket://schemas/pocket-workflow/v1",
  "workflowVersion": 1,
  "id": "startFocus",
  "inputs": {
    "selectedEventRef": "entity-ref",
    "durationSeconds": "integer",
    "purpose": "string"
  },
  "approval": {
    "mode": "before_writes",
    "group": "all_writes"
  },
  "steps": [
    {
      "id": "startTimer",
      "use": "timer.countdown.start@1",
      "with": {
        "durationSeconds": "$input.durationSeconds",
        "title": "$input.purpose",
        "sourceRef": "$input.selectedEventRef"
      },
      "dependsOn": []
    },
    {
      "id": "savePurpose",
      "use": "sticky.note.upsert@1",
      "with": {
        "stableKey": "$context.todayFocusStableKey",
        "title": "Focus purpose",
        "body": "$input.purpose",
        "color": "yellow"
      },
      "dependsOn": [
        "startTimer"
      ]
    }
  ],
  "onPartialFailure": {
    "mode": "compensate_if_available",
    "presentReceipt": true
  },
  "limits": {
    "maxSteps": 8,
    "maxDepth": 2,
    "timeoutSeconds": 30
  }
}
